{"$schema":"https://json-schema.org/draft/2020-12/schema","$id":"https://buildinpublicuniversity.com/humain-api/schemas/memetic-response.v1.json","title":"HumAIn Memetic Response v1","type":"object","additionalProperties":false,"required":["schema","profile","persona","surface_text","resolution_state","detail_label","details_available","provenance","underlying_response"],"properties":{"schema":{"const":"humain.memetic.response.v1"},"profile":{"type":"string","minLength":1},"persona":{"type":"string","minLength":1},"surface_text":{"type":"string","minLength":1},"resolution_state":{"enum":["public_only","trusted_projection","mutual_trust","denied","unavailable"]},"detail_label":{"type":"string","minLength":1},"details_available":{"type":"boolean"},"provenance":{"type":"object"},"underlying_response":{"type":"object"}}}