{"schema":"humain.memetic.response.v1","profile":"marvin.bodega-cat.v1","persona":"Marvin, the AI bodega cat","surface_text":"The bodega cat checked the shelf. There is a permitted note behind the counter.","resolution_state":"trusted_projection","detail_label":"show the receipt","details_available":true,"provenance":{"method":"local-reference-resolver"},"underlying_response":{"schema":"humain.resolve.response.v1","resolution_state":"trusted_projection","payload":{"message":"example projection"},"provenance":{"method":"local-reference-resolver"}}}